text,aspect_term,polarity
"the final insult is that while this router comes with useful software to make sharing printers wirelessly a snap , it 's only a trial version -- you have to download the trial software from the internet then pay an additional $ 40-60 to some unknown company to unlock all the features !",software,pos
i have found this little device to be quite fun to use .,device,pos
i have found this little device to be quite fun to use .,use,pos
from the belkin my reception increased over 25 % .,reception,pos
the audio cube is great .,audio cube,pos
dialogue is very noticeably clearer .,dialogue,pos
the main problems for me is that the dsub cord from the sub to the control station is too short .,dsub cord,neg
the rechargeable battery is a great feature .,battery,pos
the rechargeable battery is a great feature .,feature,pos
i highly recommend this device !,device,pos
worked great until the new firmware that installs securespot .,worked,pos
worked great until the new firmware that installs securespot .,firmware,neg
i highly recomend theese speakers .,speakers,pos
this product is good enough to integrate my clarion cx501 to my toyota camry 2001 mode .,product,pos
- fixed speaker cable -- why do this ?,speaker cable,neg
"you can't , that `` upgrade  is irreversible .",upgrade,neg
does what it should and the sound seems fine to me .,sound,pos
"sound quality is great , bass quality is beyond good .",sound quality,pos
"sound quality is great , bass quality is beyond good .",bass quality,pos
"both units are small , with similarly small speakers .",units,pos
"both units are small , with similarly small speakers .",speakers,pos
it allows the usb interface on the router to be used either for nas or print server .,usb interface,pos
"it takes approximately 20 to 90 seconds to come back online -lrb- i haven't timed it -rrb- , which doesn't sound that bad until you get nailed 10 times in one hour -lrb- that 's about as bad as it gets ; sometimes it goes for hours without rebooting -rrb- .",come back online,neg
"the ihome , however , has markedly better stereo separation as well as bass level .",stereo separation,pos
"the ihome , however , has markedly better stereo separation as well as bass level .",bass level,pos
i have been dealing with wireless routers and access points for a long time -lrb- most recently with cisco\/linksys -rrb- and this was the easiest most efficient setup i 've ever experienced .,setup,pos
when the screen wasn't contracting or glitching the overall picture quality was poor to fair .,screen,neg
when the screen wasn't contracting or glitching the overall picture quality was poor to fair .,picture quality,neg
"the speakers are pretty small , so they won't take up a lot of space , but they play as loud as you want them to , and they have great quality .",speakers,pos
"the speakers are pretty small , so they won't take up a lot of space , but they play as loud as you want them to , and they have great quality .",quality,pos
this product is hard to beat at any price .,price,pos
overall a sweet machine .,machine,pos
fits perfectly in the corner of my small desk !!,fits,pos
selected it because it looked easy to install .,install,pos
very good range and seemed to be better in the horizontal position .,range,pos
the keyboard is also very nice and quite comfortable-although it does take some getting used to .,keyboard,pos
sound effects really sound more authentic .,sound effects,pos
"the colors are bright , beautiful and clear .",colors,pos
bottom line : it didn't work the way it was supposed to so we 're returning it we bought this router for our two computers .,work,neg
"excellent heavy build quality , and the stands are not imposing and blend fairly well into the rest of my furniture .",quality,pos
"excellent heavy build quality , and the stands are not imposing and blend fairly well into the rest of my furniture .",stands,pos
"this is an outstanding product , one that lives up to the pr .",product,pos
simply this product was created and was left behind !,product,neg
easy to use with clear instructions contained in the install drive .,use,pos
easy to use with clear instructions contained in the install drive .,instructions,pos
this is the best sound system i have ever heard .,sound system,pos
the acer monitor has an extremely bright screen and its design allows the placement in an area -lrb- from a heighth perspective -rrb- that many 20  screens will not fit in .,acer monitor,pos
the acer monitor has an extremely bright screen and its design allows the placement in an area -lrb- from a heighth perspective -rrb- that many 20  screens will not fit in .,screen,pos
the acer monitor has an extremely bright screen and its design allows the placement in an area -lrb- from a heighth perspective -rrb- that many 20  screens will not fit in .,design,pos
installation was easy as advertised .,installation,pos
a + + + + + + product and very well built for apple users in mind ... ... oh yeah theres a usb port in the back for you droid people .,product,pos
a + + + + + + product and very well built for apple users in mind ... ... oh yeah theres a usb port in the back for you droid people .,built,pos
"i took them to a different room and tested them with my mp3 player , where they worked fine and sounded pretty good .",worked,pos
"i took them to a different room and tested them with my mp3 player , where they worked fine and sounded pretty good .",sounded,pos
i should 've trusted all the online comments about the terrible repair team of acer .,repair team,neg
i was looking for portability and good battery life and this product delivers both .,portability,pos
i was looking for portability and good battery life and this product delivers both .,battery life,pos
"yes , the buttons are a bit small and close , but they are functional .",buttons,pos
it works flawlessly during installation of cx501 .,works,pos
it works flawlessly during installation of cx501 .,installation,pos
"update jan 12 , 2012 the device has worked flawlessly for the past year .",worked,pos
sound quality and base is amazing .,sound quality,pos
sound quality and base is amazing .,base,pos
"first thing i tested was the speed , and i have to say it was abysmal .",speed,neg
this model router has now failed me twice in the short span of time mentioned .,model router,neg
"reliable , highly available and ease of administration and forget about me -lrb- don't bother anymore -rrb- equipment !",administration,pos
sound is crystal clear and the bass is very deep as well .,sound,pos
sound is crystal clear and the bass is very deep as well .,bass,pos
music sounds great but having surround sound in game is nice and a big difference from headphones .,surround sound,pos
"the sound was crisp , clear , and no distortion .",sound,pos
"the data rate over the network storage is rather slow , but i only use it for occasional backups so it doesn't bother me too much .",data rate,neg
wouldn't buy again because of the customer service .,customer service,neg
"made call which was immediately answered by very helpful , competent tech .",tech,pos
"the colors and viewing angle are about average , but a huge upgrade from the truly terrible quality of the other monitor .",colors,pos
"the colors and viewing angle are about average , but a huge upgrade from the truly terrible quality of the other monitor .",viewing angle,pos
"the colors and viewing angle are about average , but a huge upgrade from the truly terrible quality of the other monitor .",quality,pos
i have no problem at all recommending these stands .,stands,pos
great replacement at great price for an older bulky and heavy monitor .,price,pos
"solid , resistant to scratches , better heat dissipation .",heat dissipation,pos
"they sound wonderful , in my opinion , and i haven't even touched any equalizers .",sound,pos
"we got this on time , and it was brand new , perfect condition , performance as can be expected for the machine specifications , keep in mind i 'm extremely computer savvy , so my opinion comes to a lot of people .",performance,pos
i seem to be getting 5 to 6 hours on the battery which is sufficient for my needs .,battery,pos
"second gripe : in the 6 or so months since we purchased our batch of 30-40 of these monitors , 2 have already been returned for repair or replacement .",monitors,neg
image clarity is great -lrb- i do a lot of work in photoshop with 18mb raw image files and noticed the difference immediately -rrb- .,image,pos
"the speakers are very small and can not handle loud volume gracefully as voice coils top and bottom out , they clip the audio .",speakers,neg
"the speakers are very small and can not handle loud volume gracefully as voice coils top and bottom out , they clip the audio .",volume,neg
for me its perfect and the quality for games and word docs is more than acceptable .,quality,pos
my only complaint is like others here ... it randomly disconnects from the bluetooth and it 's really annoying when it does because it does it so often .,disconnects,neg
"you can also use a 6v dc power supply -lrb- not included -rrb- cons : - bad instructions ; like many products of this type the instructions manual is lacking and , in this case , erroneously lists the power requirements as ac when it should be dc .",instructions,neg
"you can also use a 6v dc power supply -lrb- not included -rrb- cons : - bad instructions ; like many products of this type the instructions manual is lacking and , in this case , erroneously lists the power requirements as ac when it should be dc .",instructions manual,neg
i 'd venture to say that because of it 's low cost it 's the best pc stereo set out there costwise .,cost,pos
i would not recommend this or any acer product to anyone except perhaps my ex .,acer product,neg
it was worth the wait because ag neovo 's standout 17  monitor has all this and more .,ag neovo 's standout 17  monitor,pos
"the router failed today -lrb- completely dead -rrb- , when i need to work from home due to heavy snow !",router,neg
jbl s310 ii is truly amazing .,jbl s310 ii,pos
display glitches and flashes also occurred .,display,neg
"acer has been awful to deal with , they treat their customers like rubbish , and have a miserable repair facility to match their products .",acer,neg
i hesitated for so long because of the price .,price,neg
good price !,price,pos
the range seems quite good even through walls .,range,pos
"after seeing and hearing the sound of the i-tour pop speaker , i was sold .",sound,pos
slow to download and run certain programs wish you the best and hope my review helped !,download,neg
slow to download and run certain programs wish you the best and hope my review helped !,run,neg
last night i needed to reset the router .,reset,neg
the software on the router is pretty good .,software,pos
worked fine .,worked,pos
"the backlight will periodically fail , the first time it happened i sent it in for warranty repair .",backlight,neg
"all in all , bad device , bad customer service ... run like hell from this product .",device,neg
"all in all , bad device , bad customer service ... run like hell from this product .",customer service,neg
"it worked perfectly for about a week , then the problems came .",worked,pos
i 'm not a person well read in technology but this is just an absolutely wonderful computer .,computer,pos
"all in all , this is a very good option for anyone who has a small portable computer and wants a lapdesk and external speakers .",option,pos
<p> i am very happy about my investment and the quality service of amazon and j&r store .,quality service,pos
"- if you want loud , boomy bass , this does the job very well for a computer speaker -lrb- no , these aren't going to hit as hard as larger power-guzzling woofers , but they perform as nice as or better than many home theater woofers i 've heard -rrb- .",computer speaker,pos
"- if you want loud , boomy bass , this does the job very well for a computer speaker -lrb- no , these aren't going to hit as hard as larger power-guzzling woofers , but they perform as nice as or better than many home theater woofers i 've heard -rrb- .",bass,pos
"it was really easy to set up out of the box and i got all my wireless devices -lrb- 2 laptops , 1 desktop and 2 smartphones -rrb- connected to the internet in minutes .",set up,pos
"the model is also very clean and nice , and the software is very user-friendly .",model,pos
"the model is also very clean and nice , and the software is very user-friendly .",software,pos
"this monitor is much , much better but still not great .",monitor,pos
"i did not even have to hit the `` auto tune  button , it just worked instantly .",worked,pos
"i don't think the external switch is much of a feature because in the end , you have to learn how to identify ip addresses , switch the router from from a dynamic to static ip address , and assign a static ip address that is compatible with your router or modem .",external switch,neg
and it works great too !,works,pos
"the range is great , i can list to my radio anywhere in the house .",range,pos
"pros : low weight , long battery life , decent keyboard , decent screen , does not heat up , hdmi output , flawless local hd decoding con : low audio volume , just enough cpu power",weight,pos
"pros : low weight , long battery life , decent keyboard , decent screen , does not heat up , hdmi output , flawless local hd decoding con : low audio volume , just enough cpu power",battery life,pos
"pros : low weight , long battery life , decent keyboard , decent screen , does not heat up , hdmi output , flawless local hd decoding con : low audio volume , just enough cpu power",keyboard,pos
"pros : low weight , long battery life , decent keyboard , decent screen , does not heat up , hdmi output , flawless local hd decoding con : low audio volume , just enough cpu power",screen,pos
"pros : low weight , long battery life , decent keyboard , decent screen , does not heat up , hdmi output , flawless local hd decoding con : low audio volume , just enough cpu power",heat up,pos
"pros : low weight , long battery life , decent keyboard , decent screen , does not heat up , hdmi output , flawless local hd decoding con : low audio volume , just enough cpu power",hdmi output,pos
"pros : low weight , long battery life , decent keyboard , decent screen , does not heat up , hdmi output , flawless local hd decoding con : low audio volume , just enough cpu power",local hd decoding,pos
"pros : low weight , long battery life , decent keyboard , decent screen , does not heat up , hdmi output , flawless local hd decoding con : low audio volume , just enough cpu power",audio volume,neg
"however , when you unplug the computer it beeps .",beeps,neg
"i have been disappointed to find that there is no printed instructions with it , just a crude pictorial instruction of installation , which leaves a great deal of information missing .",instructions,neg
"thats pretty much it , the speakers rock , the control station and remote are nifty , and the sub is powerful .",speakers,pos
"thats pretty much it , the speakers rock , the control station and remote are nifty , and the sub is powerful .",control station,pos
"thats pretty much it , the speakers rock , the control station and remote are nifty , and the sub is powerful .",remote,pos
"thats pretty much it , the speakers rock , the control station and remote are nifty , and the sub is powerful .",sub,pos
i haven't really need any since the display have proven to be very intelligent when resizing different screen res 's and i can use the ati drivers to adjust things like color temp and gamma .,display,pos
i have this monitor for a month now and i 'm very pleased with it .,monitor,pos
the incoming call volume is incredibly low and it is often difficult to hear my customers -lrb- it was so bad i had my hearing tested because i thought something was wrong with me .,volume,neg
"the volume is loud enough , but at louder levels there is noticable vibration and some distortion .",volume,pos
"the volume is loud enough , but at louder levels there is noticable vibration and some distortion .",vibration,neg
"the volume is loud enough , but at louder levels there is noticable vibration and some distortion .",distortion,neg
it 's a really nice looking device and can be positioned horizontally or vertically .,device,pos
all the latest acer stuff is top notch !,acer stuff,pos
"i was looking for an inexpensive , room-suited ipod speaker and this is what i got .",speaker,pos
"harmon international has done a great job on all of these equipment , the avr 525 produces crystal clear sound with excellent clarity .",avr 525,pos
"harmon international has done a great job on all of these equipment , the avr 525 produces crystal clear sound with excellent clarity .",sound,pos
"harmon international has done a great job on all of these equipment , the avr 525 produces crystal clear sound with excellent clarity .",clarity,pos
"i 'm glad i went with it , it actually exceeds my viewsonic for color , brightness , and pixel quality .",color,pos
"i 'm glad i went with it , it actually exceeds my viewsonic for color , brightness , and pixel quality .",brightness,pos
"i 'm glad i went with it , it actually exceeds my viewsonic for color , brightness , and pixel quality .",pixel quality,pos
pros : competitive cost win 7 home premium hdmi port -lrb- i could watch the amazon instant videos on my hdtv and its delivering great .,delivering,pos
it seems that with every firmware release the router gets better & better .,firmware,pos
it seems that with every firmware release the router gets better & better .,router,pos
it has very good range -- much better than the linksys router it replaced .,range,pos
the speakers themselves sound really good .,speakers,pos
the speakers themselves sound really good .,sound,pos
i am so tired of netgear 's product quality & customer service that i would never recommend netgear products to anyone i know .,quality,neg
i am so tired of netgear 's product quality & customer service that i would never recommend netgear products to anyone i know .,customer service,neg
my dwl-2100ap does not work as a repeater for di-624s and there is no firmware update to support this product .,firmware update,pos
for my work this panel is unusable .,panel,neg
"haven't setup any advanced features , but the signal strength and speed are roughly twice what i had with old router .",signal strength,pos
"haven't setup any advanced features , but the signal strength and speed are roughly twice what i had with old router .",speed,pos
"when i put it to use for my daughter 's graduation party in longer lengths , the speaker wire worked as expected , even out of doors .",speaker wire,pos
"very tight joints , excellent black finish , and precise speaker wire hook-ups .",joints,pos
"very tight joints , excellent black finish , and precise speaker wire hook-ups .",finish,pos
"very tight joints , excellent black finish , and precise speaker wire hook-ups .",speaker wire hook-ups,pos
"with it enabled , anytime we made changes to the router , we had to manually press the `` turn on radio  button on the front of the router because the gui one wouldn't work .",gui,neg
"however , because this dock plays about any mp3 player and is of good quality and low price , it should sell very well .",quality,pos
"however , because this dock plays about any mp3 player and is of good quality and low price , it should sell very well .",price,pos
i conclude that the ethernet transceiver d-link uses is not as good as that of other brands .,ethernet transceiver,neg
these are great bike speakers for the weekend cycling in the park .,speakers,pos
the screen quality is very high & the side view is very sharp & clear .,screen quality,pos
the screen quality is very high & the side view is very sharp & clear .,side view,pos
i have seen no dead pixels or color bleeding that i 've heard about with other acer models,dead pixels,pos
i have seen no dead pixels or color bleeding that i 've heard about with other acer models,color bleeding,pos
this is an excellent value .,value,pos
this netbook is closer to the notebook powers but still very cheap .,netbook,pos
my only grips are the incompatibility with xp and the usb hub in the display .,incompatibility,neg
update : i 've been using this router for 3 months and it 's still working very well - wifi remains strong and consistant .,working,pos
"i don't for-see myself having any issues with it in the coming year or two however if i do , i will know that with this product , it will be taken care of for free and quick with helpful and courteous customer service reps. the service of amazon in getting this item to me was faster than i expected and it is exactly what i knew it would be .",customer service reps,pos
both the black and the white speakers are economically priced and worth it .,speakers,pos
both the black and the white speakers are economically priced and worth it .,priced,pos
with the small cost it packs a powerful wireless punch,cost,pos
with the small cost it packs a powerful wireless punch,wireless punch,pos
otherwise a very decent monitor for its price .,monitor,pos
otherwise a very decent monitor for its price .,price,pos
"the router doesn't support port translation , e.g forward port 8080 in the outside to port 80 in the inside .",port translation,neg
the soft orange glow at the base is a nice nightlight .,base,pos
"however , since i am in an office , i normally keep them at a pretty low volume , and at low volumes , they sound a little weak .",sound,neg
"however , shareport on this new router worked 0 % of the time .",shareport,neg
the computer direct processing and shipping was outrageously fast .,shipping,pos
"when i reset it , like unplugging it and plugging it back in , i would get the n speeds 150 mbps the first time it connected and would transfer files at that speed , then usually next time i connected it would drop back to 65 or 52 mbps and stay at these speeds .",speeds,neg
"if i were to rate these speakers on my listening needs , i would give a 2.5 stars , but i 'm giving 4 because i think they do the job that most people want them for .",speakers,pos
"it 's just such a nice , light-weight , non-intrusive device which you can take anywhere .",device,pos
the sound is clear and clean but if your not on top of it you can't hear a thing .,sound,pos
"the images are vivid and crisp , the text and fonts are very clear .",images,pos
"the images are vivid and crisp , the text and fonts are very clear .",text,pos
"the images are vivid and crisp , the text and fonts are very clear .",fonts,pos
"thanks to amazon 's amazing return policy , i was able to return the product at no loss on my part .",return policy,pos
it has a usb port -- so you can plug in a usb-powered drive and have network-accessible storage .,usb port,pos
delivery was prompt .,delivery,pos
they are clears and perfect to be used along with a sub .,used,pos
"first of all , i disagree with any suggestions that the bass on this system is boomy in a bad way .",bass,neg
"first of all , i disagree with any suggestions that the bass on this system is boomy in a bad way .",system,neg
"for a small , portable , unit , this allows you to listen to , as well as share ipod music , and podcasts , in an intimate setting .",unit,pos
i tried these speakers and found them to preform well below expectations for this price .,speakers,neg
i tried these speakers and found them to preform well below expectations for this price .,preform,neg
"item shipped out quickly , was in good condition , came with easy to use set-up disk ... we haven't had to 're - set ' the router at all so far since it 's delivery , so my wife is no longer giving me the business about losing her wireless internet connection on her laptop ... added security benefits , neighbors no longer hogging signal , well worth the purchase price !",shipped out,pos
"item shipped out quickly , was in good condition , came with easy to use set-up disk ... we haven't had to 're - set ' the router at all so far since it 's delivery , so my wife is no longer giving me the business about losing her wireless internet connection on her laptop ... added security benefits , neighbors no longer hogging signal , well worth the purchase price !",condition,pos
"item shipped out quickly , was in good condition , came with easy to use set-up disk ... we haven't had to 're - set ' the router at all so far since it 's delivery , so my wife is no longer giving me the business about losing her wireless internet connection on her laptop ... added security benefits , neighbors no longer hogging signal , well worth the purchase price !",set-up disk,pos
"unfortunately , i just could not get it to work .",work,neg
"assembly of the stands is very straightforward , and well detailed in the instructions .",stands,pos
"assembly of the stands is very straightforward , and well detailed in the instructions .",instructions,pos
the sound became instantly clear again .,sound,pos
"wow , this speaker really rocks .",speaker,pos
no one sells a 1.2 mm x 2.2 mm sized -lrb- or what ever stupid size it is -rrb- power adapter .,size,neg
while upgrading the memory the keyboard connector broke .,keyboard connector,neg
"my blu-ray player and wd live tv box normally lean back , smile , and light up a smoke after a good firmware upgrade , and perform well forever thereafter .",perform,pos
"so besides the annoyances , this is a fine speaker for the amount i paid .",speaker,pos
we are well pleased with the monitor and the company .,monitor,pos
its annoying when you pay $ 100 + for a router and it doesn't work as it is supposed straight out of the box !,router,neg
this is the best speaker mount i had so far .,speaker mount,pos
i don't think that really matters though - i mean hooked my xbox 360 up to the standard vga port a little while ago and the picture was awesome .,picture,pos
